{
  "id": "QA-MAIL-team.invite_declined-empty",
  "itemIds": [
    "letter:team.invite_declined:en",
    "letter:team.invite_declined:vi",
    "letter:team.invite_declined:de",
    "letter:team.invite_declined:it",
    "letter:team.invite_declined:fr",
    "letter:team.invite_declined:nl",
    "letter:team.invite_declined:zh",
    "letter:team.invite_declined:es"
  ],
  "requirement": "team.invite_declined with missing facts sends nothing or a clean letter, never a hole",
  "oracle": {
    "source": "apps/tracy-web/src/mail/letters/team.js and comments.js header comments (approved copy, spec #809)",
    "ref": "per-kind button, facts and \"never mailed\" rules",
    "invariant": "a letter that would need a missing fact sends nothing; a comment deleted since is never mailed (R3)"
  },
  "edgeTags": ["empty"],
  "targets": ["local"],
  "effects": {
    "reads": [
      "apps/tracy-web/src/mail",
      "apps/tracy-web/src/notifications",
      "apps/tracy-web/src/lib",
      "apps/tracy-web/src/identity"
    ],
    "writes": [],
    "mail": false,
    "model": false,
    "containers": false
  },
  "prerequisites": [],
  "assertionIds": ["mail.letter.empty#team.invite_declined:"],
  "redProof": null,
  "legacyIds": []
}
