{
  "id": "QA-MAIL-team.invite_cancelled-recipient-no-self",
  "itemIds": [
    "letter:team.invite_cancelled:en",
    "letter:team.invite_cancelled:vi",
    "letter:team.invite_cancelled:de",
    "letter:team.invite_cancelled:it",
    "letter:team.invite_cancelled:fr",
    "letter:team.invite_cancelled:nl",
    "letter:team.invite_cancelled:zh",
    "letter:team.invite_cancelled:es"
  ],
  "requirement": "team.invite_cancelled: nobody is notified of their own action",
  "oracle": {
    "source": "docs/adr/0026-inbox-and-email-notifications.md",
    "ref": "R2 and decision 3",
    "invariant": "never notify the person who acted"
  },
  "edgeTags": ["recipient"],
  "targets": ["local"],
  "effects": {
    "reads": [
      "apps/tracy-web/src/mail",
      "apps/tracy-web/src/notifications",
      "apps/tracy-web/src/lib",
      "apps/tracy-web/src/identity"
    ],
    "writes": [],
    "mail": false,
    "model": false,
    "containers": false
  },
  "prerequisites": [],
  "assertionIds": ["mail.notify.no-self#team.invite_cancelled:"],
  "redProof": null,
  "legacyIds": []
}
