{
  "id": "QA-MAIL-whitelist-confirmation-no-secret-leak",
  "itemIds": [
    "direct:whitelist-confirmation:en",
    "direct:whitelist-confirmation:vi",
    "direct:whitelist-confirmation:de",
    "direct:whitelist-confirmation:it",
    "direct:whitelist-confirmation:fr",
    "direct:whitelist-confirmation:nl",
    "direct:whitelist-confirmation:zh",
    "direct:whitelist-confirmation:es"
  ],
  "requirement": "the whitelist confirmation letter prints no unrelated secret passed alongside its input",
  "oracle": {
    "source": "tests/qa/oracles/mail/oracle.json",
    "ref": "secrets",
    "invariant": "no secret reaches the letter"
  },
  "edgeTags": ["no-secret-leak"],
  "targets": ["local"],
  "effects": {
    "reads": [
      "apps/tracy-web/src/mail",
      "apps/tracy-web/src/notifications",
      "apps/tracy-web/src/lib",
      "apps/tracy-web/src/identity"
    ],
    "writes": [],
    "mail": false,
    "model": false,
    "containers": false
  },
  "prerequisites": [],
  "assertionIds": ["mail.direct.secret:whitelist-confirmation"],
  "redProof": null,
  "legacyIds": []
}
