{
  "id": "QA-MAIL-team.role_changed-happy-shape",
  "itemIds": [
    "letter:team.role_changed:en",
    "letter:team.role_changed:vi",
    "letter:team.role_changed:de",
    "letter:team.role_changed:it",
    "letter:team.role_changed:fr",
    "letter:team.role_changed:nl",
    "letter:team.role_changed:zh",
    "letter:team.role_changed:es"
  ],
  "requirement": "team.role_changed (T9) renders subject, HTML and text in all eight languages with no placeholder, raw key or printed hole",
  "oracle": {
    "source": "docs/adr/0026-inbox-and-email-notifications.md",
    "ref": "decision 5, 7",
    "invariant": "Every letter is complete in each language and rendered on the shared template; a sentence with a hole in it is never sent."
  },
  "edgeTags": ["happy"],
  "targets": ["local"],
  "effects": {
    "reads": [
      "apps/tracy-web/src/mail",
      "apps/tracy-web/src/notifications",
      "apps/tracy-web/src/lib",
      "apps/tracy-web/src/identity"
    ],
    "writes": [],
    "mail": false,
    "model": false,
    "containers": false
  },
  "prerequisites": [],
  "assertionIds": ["mail.letter.shape#team.role_changed:"],
  "redProof": null,
  "legacyIds": []
}
