{
  "id": "QA-MAIL-workspace-invite-boundary",
  "itemIds": [
    "direct:workspace-invite:en",
    "direct:workspace-invite:vi",
    "direct:workspace-invite:de",
    "direct:workspace-invite:it",
    "direct:workspace-invite:fr",
    "direct:workspace-invite:nl",
    "direct:workspace-invite:zh",
    "direct:workspace-invite:es"
  ],
  "requirement": "the workspace invitation to a person without an account stays well-formed for very long names and long site lists",
  "oracle": {
    "source": "RFC 5322 section 2.2.3",
    "ref": "RFC 5322 section 2.2.3",
    "invariant": "subject has no CR/LF; HTML complete"
  },
  "edgeTags": ["boundary"],
  "targets": ["local"],
  "effects": {
    "reads": [
      "apps/tracy-web/src/mail",
      "apps/tracy-web/src/notifications",
      "apps/tracy-web/src/lib",
      "apps/tracy-web/src/identity"
    ],
    "writes": [],
    "mail": false,
    "model": false,
    "containers": false
  },
  "prerequisites": [],
  "assertionIds": ["mail.direct.boundary:workspace-invite"],
  "redProof": null,
  "legacyIds": []
}
