{
  "id": "QA-MAIL-team.invited-locale",
  "itemIds": [
    "direct:team.invited:en",
    "direct:team.invited:vi",
    "direct:team.invited:de",
    "direct:team.invited:it",
    "direct:team.invited:fr",
    "direct:team.invited:nl",
    "direct:team.invited:zh",
    "direct:team.invited:es"
  ],
  "requirement": "the invitation letter (T1) reads in eight languages; others read as English",
  "oracle": {
    "source": "docs/adr/0026-inbox-and-email-notifications.md",
    "ref": "decision 5",
    "invariant": "the 8 interface languages, else English"
  },
  "edgeTags": ["locale"],
  "targets": ["local"],
  "effects": {
    "reads": [
      "apps/tracy-web/src/mail",
      "apps/tracy-web/src/notifications",
      "apps/tracy-web/src/lib",
      "apps/tracy-web/src/identity"
    ],
    "writes": [],
    "mail": false,
    "model": false,
    "containers": false
  },
  "prerequisites": [],
  "assertionIds": ["mail.direct.locale:team.invited"],
  "redProof": null,
  "legacyIds": []
}
