{
  "id": "QA-MAIL-team.invite_accepted-locale",
  "itemIds": [
    "letter:team.invite_accepted:en",
    "letter:team.invite_accepted:vi",
    "letter:team.invite_accepted:de",
    "letter:team.invite_accepted:it",
    "letter:team.invite_accepted:fr",
    "letter:team.invite_accepted:nl",
    "letter:team.invite_accepted:zh",
    "letter:team.invite_accepted:es"
  ],
  "requirement": "team.invite_accepted reads in each of the eight languages and any other language reads as English",
  "oracle": {
    "source": "docs/adr/0026-inbox-and-email-notifications.md",
    "ref": "decision 5",
    "invariant": "the 8 interface languages; every other value (ja, zh-TW, empty, garbage) is English"
  },
  "edgeTags": ["locale"],
  "targets": ["local"],
  "effects": {
    "reads": [
      "apps/tracy-web/src/mail",
      "apps/tracy-web/src/notifications",
      "apps/tracy-web/src/lib",
      "apps/tracy-web/src/identity"
    ],
    "writes": [],
    "mail": false,
    "model": false,
    "containers": false
  },
  "prerequisites": [],
  "assertionIds": ["mail.letter.locale#team.invite_accepted:"],
  "redProof": null,
  "legacyIds": []
}
