{
  "id": "QA-MAIL-team.edit_access_approved-no-secret-leak",
  "itemIds": [
    "letter:team.edit_access_approved:en",
    "letter:team.edit_access_approved:vi",
    "letter:team.edit_access_approved:de",
    "letter:team.edit_access_approved:it",
    "letter:team.edit_access_approved:fr",
    "letter:team.edit_access_approved:nl",
    "letter:team.edit_access_approved:zh",
    "letter:team.edit_access_approved:es"
  ],
  "requirement": "team.edit_access_approved prints no field the renderer was not meant to print",
  "oracle": {
    "source": "tests/qa/oracles/mail/oracle.json",
    "ref": "secrets",
    "invariant": "no secret, token or password of the row or the actor reaches any part of the letter"
  },
  "edgeTags": ["no-secret-leak"],
  "targets": ["local"],
  "effects": {
    "reads": [
      "apps/tracy-web/src/mail",
      "apps/tracy-web/src/notifications",
      "apps/tracy-web/src/lib",
      "apps/tracy-web/src/identity"
    ],
    "writes": [],
    "mail": false,
    "model": false,
    "containers": false
  },
  "prerequisites": [],
  "assertionIds": ["mail.letter.secret#team.edit_access_approved:"],
  "redProof": null,
  "legacyIds": []
}
