{
  "id": "QA-MAIL-comment.reply-unsubscribe",
  "itemIds": [
    "letter:comment.reply:en",
    "letter:comment.reply:vi",
    "letter:comment.reply:de",
    "letter:comment.reply:it",
    "letter:comment.reply:fr",
    "letter:comment.reply:nl",
    "letter:comment.reply:zh",
    "letter:comment.reply:es"
  ],
  "requirement": "comment.reply: carries a working one-click unsubscribe for its own group, none in the locked group",
  "oracle": {
    "source": "tests/qa/oracles/mail/oracle.json",
    "ref": "groups",
    "invariant": "RFC 8058 headers for switchable groups only"
  },
  "edgeTags": ["unsubscribe"],
  "targets": ["local"],
  "effects": {
    "reads": [
      "apps/tracy-web/src/mail",
      "apps/tracy-web/src/notifications",
      "apps/tracy-web/src/lib",
      "apps/tracy-web/src/identity"
    ],
    "writes": [],
    "mail": false,
    "model": false,
    "containers": false
  },
  "prerequisites": [],
  "assertionIds": ["mail.notify.unsubscribe-header#comment.reply:"],
  "redProof": null,
  "legacyIds": []
}
