{
  "id": "QA-MAIL-team.invite_cancelled-deduplicate",
  "itemIds": [
    "letter:team.invite_cancelled:en",
    "letter:team.invite_cancelled:vi",
    "letter:team.invite_cancelled:de",
    "letter:team.invite_cancelled:it",
    "letter:team.invite_cancelled:fr",
    "letter:team.invite_cancelled:nl",
    "letter:team.invite_cancelled:zh",
    "letter:team.invite_cancelled:es"
  ],
  "requirement": "team.invite_cancelled: a recipient listed several times gets one row and one letter",
  "oracle": {
    "source": "docs/adr/0026-inbox-and-email-notifications.md",
    "ref": "decision 4",
    "invariant": "one row per recipient"
  },
  "edgeTags": ["deduplicate"],
  "targets": ["local"],
  "effects": {
    "reads": [
      "apps/tracy-web/src/mail",
      "apps/tracy-web/src/notifications",
      "apps/tracy-web/src/lib",
      "apps/tracy-web/src/identity"
    ],
    "writes": [],
    "mail": false,
    "model": false,
    "containers": false
  },
  "prerequisites": [],
  "assertionIds": ["mail.notify.dedupe#team.invite_cancelled:"],
  "redProof": null,
  "legacyIds": []
}
