{
  "id": "QA-MAIL-signin-code-suite-visual",
  "itemIds": ["direct:signin-code:en", "direct:signin-code:vi"],
  "requirement": "a person looks at the sign-in code letter in English and Vietnamese",
  "oracle": {
    "source": "reviewed templates (templates/README.md)",
    "ref": "contact sheet",
    "invariant": "only a person can accept look and wording"
  },
  "edgeTags": [],
  "targets": ["local"],
  "effects": {
    "reads": [],
    "writes": [],
    "mail": false,
    "model": false,
    "containers": false
  },
  "prerequisites": ["playwright-chromium"],
  "assertionIds": ["manual:contact-sheet:signin-code"],
  "redProof": null,
  "legacyIds": []
}
