{
  "id": "QA-MAIL-comment.reply-happy-links",
  "itemIds": [
    "letter:comment.reply:en",
    "letter:comment.reply:vi",
    "letter:comment.reply:de",
    "letter:comment.reply:it",
    "letter:comment.reply:fr",
    "letter:comment.reply:nl",
    "letter:comment.reply:zh",
    "letter:comment.reply:es"
  ],
  "requirement": "comment.reply links absolutely to the deployment: its button opens the comment door, plus the manage link",
  "oracle": {
    "source": "apps/tracy-web/src/mail/letters/team.js and comments.js header comments (approved copy, spec #809)",
    "ref": "per-kind button, facts and \"never mailed\" rules",
    "invariant": "button: comment; footer carries Manage notifications"
  },
  "edgeTags": ["happy"],
  "targets": ["local"],
  "effects": {
    "reads": [
      "apps/tracy-web/src/mail",
      "apps/tracy-web/src/notifications",
      "apps/tracy-web/src/lib",
      "apps/tracy-web/src/identity"
    ],
    "writes": [],
    "mail": false,
    "model": false,
    "containers": false
  },
  "prerequisites": [],
  "assertionIds": ["mail.letter.links#comment.reply:"],
  "redProof": null,
  "legacyIds": []
}
