{
  "id": "QA-MAIL-team.joined-happy-links",
  "itemIds": [
    "letter:team.joined:en",
    "letter:team.joined:vi",
    "letter:team.joined:de",
    "letter:team.joined:it",
    "letter:team.joined:fr",
    "letter:team.joined:nl",
    "letter:team.joined:zh",
    "letter:team.joined:es"
  ],
  "requirement": "team.joined links absolutely to the deployment: its button opens the team door, plus the manage link",
  "oracle": {
    "source": "apps/tracy-web/src/mail/letters/team.js and comments.js header comments (approved copy, spec #809)",
    "ref": "per-kind button, facts and \"never mailed\" rules",
    "invariant": "button: team; footer carries Manage notifications"
  },
  "edgeTags": ["happy"],
  "targets": ["local"],
  "effects": {
    "reads": [
      "apps/tracy-web/src/mail",
      "apps/tracy-web/src/notifications",
      "apps/tracy-web/src/lib",
      "apps/tracy-web/src/identity"
    ],
    "writes": [],
    "mail": false,
    "model": false,
    "containers": false
  },
  "prerequisites": [],
  "assertionIds": ["mail.letter.links#team.joined:"],
  "redProof": null,
  "legacyIds": []
}
