{
  "id": "QA-MAIL-team.site_deleted-recipient-routing",
  "itemIds": [
    "letter:team.site_deleted:en",
    "letter:team.site_deleted:vi",
    "letter:team.site_deleted:de",
    "letter:team.site_deleted:it",
    "letter:team.site_deleted:fr",
    "letter:team.site_deleted:nl",
    "letter:team.site_deleted:zh",
    "letter:team.site_deleted:es"
  ],
  "requirement": "team.site_deleted: the notifier addresses the letter to the recipient, never the actor, in the recipient's language",
  "oracle": {
    "source": "docs/adr/0026-inbox-and-email-notifications.md",
    "ref": "decision 5, R2",
    "invariant": "language of the recipient: chosen, else English; one letter per recipient"
  },
  "edgeTags": ["recipient", "locale"],
  "targets": ["local"],
  "effects": {
    "reads": [
      "apps/tracy-web/src/mail",
      "apps/tracy-web/src/notifications",
      "apps/tracy-web/src/lib",
      "apps/tracy-web/src/identity"
    ],
    "writes": [],
    "mail": false,
    "model": false,
    "containers": false
  },
  "prerequisites": [],
  "assertionIds": ["mail.notify.recipient#team.site_deleted:"],
  "redProof": null,
  "legacyIds": []
}
