{
  "id": "QA-MAIL-comment.mention-happy-shape",
  "itemIds": [
    "letter:comment.mention:en",
    "letter:comment.mention:vi",
    "letter:comment.mention:de",
    "letter:comment.mention:it",
    "letter:comment.mention:fr",
    "letter:comment.mention:nl",
    "letter:comment.mention:zh",
    "letter:comment.mention:es"
  ],
  "requirement": "comment.mention (C1) renders subject, HTML and text in all eight languages with no placeholder, raw key or printed hole",
  "oracle": {
    "source": "docs/adr/0026-inbox-and-email-notifications.md",
    "ref": "decision 5, 7",
    "invariant": "Every letter is complete in each language and rendered on the shared template; a sentence with a hole in it is never sent."
  },
  "edgeTags": ["happy"],
  "targets": ["local"],
  "effects": {
    "reads": [
      "apps/tracy-web/src/mail",
      "apps/tracy-web/src/notifications",
      "apps/tracy-web/src/lib",
      "apps/tracy-web/src/identity"
    ],
    "writes": [],
    "mail": false,
    "model": false,
    "containers": false
  },
  "prerequisites": [],
  "assertionIds": ["mail.letter.shape#comment.mention:"],
  "redProof": null,
  "legacyIds": []
}
